{
  "candidate": {
    "package_version": "0.12.0",
    "runner": "benchmarks/v013/scale_performance.py",
    "runner_sha256": "01ea3e25e11b77e96f9b614a81bba28ccf262f36587b70e546f8545560f72579"
  },
  "claim_eligible": false,
  "claim_ineligibility_reason": "Deterministic synthetic temporary Vault construction diagnostic; it is not real-user quality evidence, a competitor run, or a release claim.",
  "configuration": {
    "execute_expensive": true,
    "max_latency_samples": 1000,
    "projection_profile": "standard",
    "query_plan_version": "6",
    "query_runs": 3,
    "rss_requests": 10000,
    "scales": [
      1000,
      10000,
      100000
    ],
    "semantic_profile": "not_executed",
    "warmup_runs": 1
  },
  "environment": {
    "cpu": {
      "logical_count": 12,
      "model": "arm"
    },
    "filesystem": {
      "block_size": 4096,
      "kind": "unknown",
      "reason": "Python statvfs does not expose a portable filesystem type"
    },
    "git_commit": "69db28cb99846540e3b7c3c600f5268705405015",
    "git_reason": null,
    "os": {
      "machine": "arm64",
      "name": "Darwin",
      "release": "25.5.0"
    },
    "python": "3.11.15",
    "ram": {
      "reason": null,
      "total_bytes": 25769803776
    },
    "working_tree_dirty": false
  },
  "generated_at_utc": "2026-08-11T17:34:24Z",
  "limitations": [
    "No network, model, Gold/scorer, user Vault, legal source, or case data is read.",
    "Deterministic synthetic identifiers measure mechanics only and are claim-ineligible.",
    "Scale counts are synthetic source-derived Asset records; autonomous probes are bounded separately and do not represent real-user knowledge quality.",
    "not_executed, degraded, and fail outcomes are retained and never converted to pass.",
    "10k/100k reruns require --execute-expensive; no smaller substitute is used."
  ],
  "operation_inventory": [
    "exact_get",
    "wiki_page",
    "backlinks",
    "outlinks",
    "compiled_first",
    "evidence_first",
    "context",
    "verify",
    "source_update",
    "incremental_projection",
    "full_rebuild",
    "projection_equivalence",
    "mcp_cold",
    "mcp_warm",
    "concurrent_read",
    "rss_stability_10000_requests",
    "cache_invalidation_after_source_update",
    "storage_sqlite_bytes",
    "storage_file_count",
    "storage_canvas_count",
    "provider_payload_bytes"
  ],
  "overall": {
    "degraded_count": 0,
    "executed_count": 48,
    "fail_count": 0,
    "limitations": [
      "This construction diagnostic cannot satisfy the v0.13 release gate.",
      "Any not_executed operation remains an unmet gate and is never counted as pass."
    ],
    "not_executed": [
      {
        "operation": "rss_stability_10000_requests",
        "reason": "RSS stability requires a dedicated child-process harness; this construction runner does not claim a substitute measurement",
        "scale": 1000
      },
      {
        "operation": "source_update",
        "reason": "source-update and projection-equivalence probes are frozen to the 1k regression fixture; this scale was not executed",
        "scale": 10000
      },
      {
        "operation": "incremental_projection",
        "reason": "source-update and projection-equivalence probes are frozen to the 1k regression fixture; this scale was not executed",
        "scale": 10000
      },
      {
        "operation": "projection_equivalence",
        "reason": "source-update and projection-equivalence probes are frozen to the 1k regression fixture; this scale was not executed",
        "scale": 10000
      },
      {
        "operation": "mcp_cold",
        "reason": "persistent MCP cold/warm diagnostics are frozen to the 1k synthetic fixture; this scale was not executed",
        "scale": 10000
      },
      {
        "operation": "mcp_warm",
        "reason": "persistent MCP cold/warm diagnostics are frozen to the 1k synthetic fixture; this scale was not executed",
        "scale": 10000
      },
      {
        "operation": "rss_stability_10000_requests",
        "reason": "RSS process isolation requires a dedicated child-process harness; this local construction runner does not claim a substitute measurement",
        "scale": 10000
      },
      {
        "operation": "cache_invalidation_after_source_update",
        "reason": "source-update and projection-equivalence probes are frozen to the 1k regression fixture; this scale was not executed",
        "scale": 10000
      },
      {
        "operation": "source_update",
        "reason": "source-update and projection-equivalence probes are frozen to the 1k regression fixture; this scale was not executed",
        "scale": 100000
      },
      {
        "operation": "incremental_projection",
        "reason": "source-update and projection-equivalence probes are frozen to the 1k regression fixture; this scale was not executed",
        "scale": 100000
      },
      {
        "operation": "projection_equivalence",
        "reason": "source-update and projection-equivalence probes are frozen to the 1k regression fixture; this scale was not executed",
        "scale": 100000
      },
      {
        "operation": "mcp_cold",
        "reason": "persistent MCP cold/warm diagnostics are frozen to the 1k synthetic fixture; this scale was not executed",
        "scale": 100000
      },
      {
        "operation": "mcp_warm",
        "reason": "persistent MCP cold/warm diagnostics are frozen to the 1k synthetic fixture; this scale was not executed",
        "scale": 100000
      },
      {
        "operation": "rss_stability_10000_requests",
        "reason": "RSS stability requires a dedicated child-process harness; this construction runner does not claim a substitute measurement",
        "scale": 100000
      },
      {
        "operation": "cache_invalidation_after_source_update",
        "reason": "source-update and projection-equivalence probes are frozen to the 1k regression fixture; this scale was not executed",
        "scale": 100000
      }
    ],
    "not_executed_count": 15,
    "operation_count": 63,
    "pass_count": 17,
    "release_gate_passed": false,
    "status": "not_released"
  },
  "profile": "construction_diagnostic",
  "reference_targets": {
    "cache_invalidation_after_source_update": {
      "stale_cache_served": {
        "operator": "==",
        "unit": "boolean",
        "value": false
      }
    },
    "concurrent_readers": {
      "successful_readers": {
        "operator": ">=",
        "unit": "readers",
        "value": 8
      }
    },
    "projection_equivalence": {
      "exact": {
        "operator": "==",
        "unit": "boolean",
        "value": true
      }
    },
    "provider_hard_limit_violations": {
      "violations": {
        "operator": "==",
        "unit": "count",
        "value": 0
      }
    },
    "rss_stability_10000_requests": {
      "rss_growth_percent": {
        "operator": "<=",
        "unit": "%",
        "value": 10
      }
    },
    "scale_1000": {
      "backlinks_p95_ms": {
        "operator": "<=",
        "unit": "ms",
        "value": 150
      },
      "compiled_first_p95_ms": {
        "operator": "<=",
        "unit": "ms",
        "value": 500
      },
      "wiki_page_p95_ms": {
        "operator": "<=",
        "unit": "ms",
        "value": 150
      }
    },
    "scale_10000": {
      "compiled_first_p95_ms": {
        "operator": "<=",
        "unit": "ms",
        "value": 1000
      },
      "context_p95_ms": {
        "operator": "<=",
        "unit": "ms",
        "value": 1200
      },
      "exact_get_p95_ms": {
        "operator": "<=",
        "unit": "ms",
        "value": 100
      }
    },
    "scale_100000": {
      "compiled_first_p95_ms": {
        "operator": "<=",
        "unit": "ms",
        "value": 2000
      },
      "no_full_filesystem_scan": {
        "operator": "==",
        "unit": "boolean",
        "value": false
      },
      "no_per_request_full_verify": {
        "operator": "==",
        "unit": "boolean",
        "value": false
      }
    }
  },
  "release_gate_passed": false,
  "report_sha256": "ee353da1ffc3d2633aec340cdae07c25a79999e3ea810e57db6967ad49d9994f",
  "rerun_commands": [
    "uv run python -m benchmarks.v013.scale_performance --output REPORT.json --scale 1000 --query-runs 3 --warmup-runs 1 --rss-requests 10000",
    "uv run python -m benchmarks.v013.scale_performance --output REPORT.json --scale 10000 --query-runs 3 --warmup-runs 1 --rss-requests 10000 --execute-expensive",
    "uv run python -m benchmarks.v013.scale_performance --output REPORT.json --scale 100000 --query-runs 3 --warmup-runs 1 --rss-requests 10000 --execute-expensive"
  ],
  "scale_reports": [
    {
      "fixture_reason": "real temporary synthetic Vault created and torn down by the harness",
      "fixture_status": "executed",
      "object_count": 1000,
      "operations": [
        {
          "judgment": "not_applicable",
          "latency_ms": {
            "max": 1.009667,
            "p50": 0.815625,
            "p95": 1.009667,
            "p99": 1.009667,
            "samples": [
              0.815625,
              0.773125,
              1.009667
            ]
          },
          "limitation": "Synthetic construction diagnostic only; timing is host-local and claim-ineligible.",
          "measured_value": null,
          "measurement": {
            "cache_invalidation": null,
            "canvas_count": null,
            "file_count": null,
            "full_filesystem_scan": null,
            "per_request_full_verify": null,
            "projection_equivalence": null,
            "provider_hard_limit_violations": null,
            "provider_payload_bytes": null,
            "rss_growth_percent": null,
            "source_update": null,
            "stale_cache_served": null,
            "successful_readers": null,
            "unit": null,
            "valid": null,
            "value": null
          },